Name,Price,Value,URL
"«Impulse», пастилки со вкусом клубники и кокоса, 14,4 г","40,90 ₽",за   шт,https://kdvonline.ru/product/pastilki-so-vkusom-klubniki-i-kokosa-33258
"«Impulse», пастилки со вкусом яблока и корицы, 14,4 г","40,90 ₽",за   шт,https://kdvonline.ru/product/pastilki-so-vkusom-yabloka-i-koritsy-33257
"«Impulse», пастилки со вкусом манго, без сахара, 14,4 г","40,90 ₽",за   шт,https://kdvonline.ru/product/pastilki-so-vkusom-mango-bez-sakhara-22756
"«Impulse», пастилки со вкусом мандарина, без сахара, 14,4 г","40,90 ₽",за   шт,https://kdvonline.ru/product/pastilki-so-vkusom-mandarina-bez-sakhara-2278
"«Impulse», пастилки со вкусом мяты, без сахара, 14,4 г","40,90 ₽",за   шт,https://kdvonline.ru/product/pastilki-so-vkusom-myaty-bez-sakhara-2277
"«Impulse», жевательная резинка со вкусом «Мята», без сахара, 14 г","18,50 ₽","Акция21,00 ₽за   шт",https://kdvonline.ru/product/zhevatelnaya-rezinka-so-vkusom-myata-bez-sakhara-1303
"«Impulse», жевательная резинка со вкусом «Клубника», без сахара, 14 г","18,50 ₽","Акция21,00 ₽за   шт",https://kdvonline.ru/product/zhevatelnaya-rezinka-so-vkusom-klubnika-bez-sakhara-1302
"«Impulse», жевательная резинка со вкусом Multi-Frutti, без сахара, 14 г","18,50 ₽","ХитАкция21,00 ₽за   шт",https://kdvonline.ru/product/zhevatelnaya-rezinka-so-vkusom-multi-frutti-bez-sakhara-1305
"«Impulse», жевательная резинка со вкусом «Арбуз», без сахара, 14 г","18,50 ₽","Акция21,00 ₽за   шт",https://kdvonline.ru/product/zhevatelnaya-rezinka-so-vkusom-arbuz-bez-sakhara-1301
